<?xml version="1.0" encoding="UTF-8"?>
<!--======================================================================= -->
<!-- DSDD_CONFIG_AUTOSAR.XML                                                -->
<!--======================================================================= -->
<DataDictionary xsi:noNamespaceSchemaLocation="dsdd_autosar_config.xsd" xmlns:xsi="http://www.w3.org/2001/XMLSchema-instance">
	<Configuration>
		<AUTOSAR>
			<Settings>
				<SupportedArVersions>
					<ArVersion>
						<AutosarVersion>2.1</AutosarVersion>
						<Revision>4</Revision>
						<SchemaFile>../2_1_4/autosar.xsd</SchemaFile>
						<BaseTypeGenericFile>../2_1_4/BaseTypeGeneric.arxml</BaseTypeGenericFile>
					</ArVersion>
					<ArVersion>
						<AutosarVersion>3.0</AutosarVersion>
						<Revision>2</Revision>
						<SchemaFile>../3_0_2/autosar.xsd</SchemaFile>
						<BaseTypeGenericFile>../3_0_2/BaseTypeGeneric.arxml</BaseTypeGenericFile>
					</ArVersion>
					<ArVersion>
						<AutosarVersion>3.0</AutosarVersion>
						<Revision>4</Revision>
						<SchemaFile>../3_0_4/autosar.xsd</SchemaFile>
						<BaseTypeGenericFile>../3_0_4/BaseTypeGeneric.arxml</BaseTypeGenericFile>
					</ArVersion>
					<ArVersion>
						<AutosarVersion>3.0</AutosarVersion>
						<Revision>6</Revision>
						<SchemaFile>../3_0_6/autosar.xsd</SchemaFile>
						<BaseTypeGenericFile>../3_0_6/BaseTypeGeneric.arxml</BaseTypeGenericFile>
					</ArVersion>
					<ArVersion>
						<AutosarVersion>3.0</AutosarVersion>
						<Revision>7</Revision>
						<SchemaFile>../3_0_7/autosar.xsd</SchemaFile>
						<BaseTypeGenericFile>../3_0_7/BaseTypeGeneric.arxml</BaseTypeGenericFile>
					</ArVersion>
					<ArVersion>
						<AutosarVersion>3.1</AutosarVersion>
						<Revision>0</Revision>
						<SchemaFile>../3_1_0/autosar.xsd</SchemaFile>
						<BaseTypeGenericFile>../3_1_0/BaseTypeGeneric.arxml</BaseTypeGenericFile>
					</ArVersion>
					<ArVersion>
						<AutosarVersion>3.1</AutosarVersion>
						<Revision>2</Revision>
						<SchemaFile>../3_1_2/autosar.xsd</SchemaFile>
						<BaseTypeGenericFile>../3_1_2/BaseTypeGeneric.arxml</BaseTypeGenericFile>
					</ArVersion>
					<ArVersion>
						<AutosarVersion>3.1</AutosarVersion>
						<Revision>4</Revision>
						<SchemaFile>../3_1_4/autosar.xsd</SchemaFile>
						<BaseTypeGenericFile>../3_1_4/BaseTypeGeneric.arxml</BaseTypeGenericFile>
					</ArVersion>
					<ArVersion>
						<AutosarVersion>3.1</AutosarVersion>
						<Revision>5</Revision>
						<SchemaFile>../3_1_5/autosar.xsd</SchemaFile>
						<BaseTypeGenericFile>../3_1_5/BaseTypeGeneric.arxml</BaseTypeGenericFile>
					</ArVersion>
					<ArVersion>
						<AutosarVersion>3.2</AutosarVersion>
						<Revision>1</Revision>
						<SchemaFile>../3_2_1/autosar.xsd</SchemaFile>
						<BaseTypeGenericFile>../3_2_1/BaseTypeGeneric.arxml</BaseTypeGenericFile>
					</ArVersion>
					<ArVersion>
						<AutosarVersion>3.2</AutosarVersion>
						<Revision>2</Revision>
						<SchemaFile>../3_2_2/autosar.xsd</SchemaFile>
						<BaseTypeGenericFile>../3_2_2/BaseTypeGeneric.arxml</BaseTypeGenericFile>
					</ArVersion>
					<ArVersion>
						<AutosarVersion>3.2</AutosarVersion>
						<Revision>3</Revision>
						<SchemaFile>../3_2_3/autosar.xsd</SchemaFile>
						<BaseTypeGenericFile>../3_2_3/BaseTypeGeneric.arxml</BaseTypeGenericFile>
					</ArVersion>
					<ArVersion>
						<AutosarVersion>4.0</AutosarVersion>
						<Revision>2</Revision>
						<SchemaFile>../4_0_2/AUTOSAR_4-0-2.xsd</SchemaFile>
						<TransformationFileExport>../4_0_2/ar422to402.xsl</TransformationFileExport>
						<BaseTypeGenericFile>../4_0_2/BaseTypeGeneric.arxml</BaseTypeGenericFile>
					</ArVersion>
					<ArVersion>
						<AutosarVersion>4.0</AutosarVersion>
						<Revision>3</Revision>
						<SchemaFile>../4_0_3/AUTOSAR_4-0-3.xsd</SchemaFile>
						<TransformationFileExport>../4_0_3/ar422to403.xsl</TransformationFileExport>
						<BaseTypeGenericFile>../4_0_3/BaseTypeGeneric.arxml</BaseTypeGenericFile>
					</ArVersion>
					<ArVersion>
						<AutosarVersion>4.1</AutosarVersion>
						<Revision>1</Revision>
						<SchemaFile>../4_1_1/AUTOSAR_4-1-1.xsd</SchemaFile>
						<TransformationFileExport>../4_1_1/ar422to411.xsl</TransformationFileExport>
						<BaseTypeGenericFile>../4_1_1/BaseTypeGeneric.arxml</BaseTypeGenericFile>
					</ArVersion>
					<ArVersion>
						<AutosarVersion>4.1</AutosarVersion>
						<Revision>2</Revision>
						<SchemaFile>../4_1_2/AUTOSAR_4-1-2.xsd</SchemaFile>
						<TransformationFileExport>../4_1_2/ar422to412.xsl</TransformationFileExport>
						<BaseTypeGenericFile>../4_1_2/BaseTypeGeneric.arxml</BaseTypeGenericFile>
					</ArVersion>
					<ArVersion>
						<AutosarVersion>4.1</AutosarVersion>
						<Revision>3</Revision>
						<SchemaFile>../4_1_3/AUTOSAR_4-1-3.xsd</SchemaFile>
						<TransformationFileExport>../4_1_3/ar422to413.xsl</TransformationFileExport>
						<BaseTypeGenericFile>../4_1_3/BaseTypeGeneric.arxml</BaseTypeGenericFile>
					</ArVersion>
					<ArVersion>
						<AutosarVersion>4.2</AutosarVersion>
						<Revision>1</Revision>
						<SchemaFile>../4_2_1/AUTOSAR_4-2-1.xsd</SchemaFile>
						<TransformationFileExport>../4_2_1/ar422to421.xsl</TransformationFileExport>
						<BaseTypeGenericFile>../4_2_1/BaseTypeGeneric.arxml</BaseTypeGenericFile>
					</ArVersion>
					<ArVersion>
						<AutosarVersion>4.2</AutosarVersion>
						<Revision>2</Revision>
						<SchemaFile>../4_2_2/AUTOSAR_4-2-2.xsd</SchemaFile>
						<BaseTypeGenericFile>../4_2_2/BaseTypeGeneric.arxml</BaseTypeGenericFile>
					</ArVersion>
					<ArVersion>
						<AutosarVersion>4.3</AutosarVersion>
						<Revision>0</Revision>
						<SchemaFile>../4_3_0/AUTOSAR_4-3-0.xsd</SchemaFile>
						<TransformationFileExport>../4_3_0/ar422to430.xsl</TransformationFileExport>
						<TransformationFileImport>../4_3_0/ar430to422.xsl</TransformationFileImport>
						<BaseTypeGenericFile>../4_3_0/BaseTypeGeneric.arxml</BaseTypeGenericFile>
					</ArVersion>
				</SupportedArVersions>
			</Settings>
			<NameTemplates>
				<!-- Example: <NameTemplate Key="INTERNAL-BEHAVIOR"  Value="IB_$(ItemName)"/>-->
			</NameTemplates>
		</AUTOSAR>
	</Configuration>
</DataDictionary>
